id,Дата,Имя,Отзыв,Показывать
1,25.07.2020,Наталья Парфенова,"Отличный Центр , внимательный персонал. Проходить ТО комфортно",TRUE
2,09.10.2020,Александр Семенов,Отличный сервис!!! 👍👍👍,TRUE
3,25.12.2020,Кот Бегемот,"Обращался с заменой сцепления и заменой масла в мкпп, все сделали быстро и без лишних вопросов. Всем доволен.",TRUE
4,09.01.2021,Мария К.,"Быстро сделали Т О.аж за 2 часа,молодцы!!все качественно и не дорого! СПАСИБО",FALSE
5,05.02.2021,Кто-то,"Отзыв, который не будет показываться",FALSE